194.667	Our First Power Moon
287.367	Multi Moon Atop the Falls
318.000	Above a High Cliff
327.900	Treasure of the Waterfall Basin
422.567	Overlooking the Desert Town
430.833	Bird Traveling the Desert
440.967	A Rumble from the Sandy Floor
476.700	Hidden Room in the Flowing Sands
496.233	Sphynx's Treasure Vault
513.567	Lost in the Luggage
568.300	Secret of the Inverted Mural
591.267	Hidden Room in the Inverted Pyramid
619.567	On the Statue's Tail
679.133	Showdown on the Inverted Pyramid
737.767	Sand Kingdom Slots
759.000	Atop the Highest Tower
805.500	Goomba Tower Assembly
835.900	Underground Treasure Chest
951.900	The Hole in the Desert
1060.567	Beneath the Roots of a Moving Tree
1085.833	Glowing in the Deep Woods
1108.567	The Hard Rock in Deep Woods
1115.567	Rolling Rock in the Deep Woods
1133.567	By the Babbling Brook in the Deep Woods
1174.967	Atop a Tall Tree
1192.733	Tucked Away Inside a Tunnel
1209.600	Climb the Cliff to Get the Nut
1236.500	The Nut at the Dead End
1249.533	Road to Sky Garden
1279.267	Cracked Nut on a Crumbling Tower
1306.367	Nut Planted in the Tower
1312.533	Stretching Your Legs
1365.767	Flower Thieves of Sky Garden
1453.467	End of the Hidden Passage
1463.767	Cheep Cheep Crossing
1475.333	Dorrie-Back Rider
1491.333	From the Broken Pillar
1542.233	Broodals Over the Lake
1571.467	On the Lakeshore
1715.833	On the Mountain Road
1735.100	A Butterfly's Treasure
1742.667	Over the Fuzzies, Above the Swamp
1755.067	Avoiding Fuzzies Inside the Wall
1768.667	Enjoying the View of Forgotten Isle
1781.733	Cave Gardening
1790.300	On a Tree in the Swamp
1814.000	Inside the Stone Cage
1823.767	The Caged Gold
1829.800	Peeking Out from Under the Bridge
1849.767	Soaring Over the Forgotten Isle!
1867.700	Twist ‘n' Turn-Up Treasure
1949.167	Girder Sandwich
1968.367	Swaying in the Breeze
1998.600	City Hall Lost & Found
2103.300	New Donk City's Pest Problem
2138.067	Secret Girder Tunnel!
2169.267	Bench Friends
2200.000	Drummer on Board!
2229.233	Bassist on Board!
2252.267	Glittering Above the Pool
2264.100	Left at the Cafe?
2284.767	Trumpeter on Board!
2315.900	Powering Up the Station
2360.433	Sewer Treasure
2474.233	Celebrating in the Streets!
2538.633	A Traditional Festival!
2568.033	A Tourist in the Metro Kingdom!
2662.567	Entrance to Shiveria
2683.533	Shopping in Shiveria
2702.267	The Shiverian Treasure Chest
2715.900	Shining in the Snow in Town
2889.867	The Bound Bowl Grand Prix
2919.733	Snow Kingdom Timer Challenge 2
2935.067	Caught Hopping in the Snow!
2953.167	Fishing in the Glacier!
3024.300	A Rumble from the Sandy Floor
3133.700	Taking Notes: Ocean Surface Dash
3151.800	Ride the Jetstream
3163.600	On the Cliff Overlooking the Beach
3178.067	Good Job, Captain Toad!
3192.100	The Seal Above the Canyon
3224.033	The Back Canyon: Excavate!
3242.133	What the Waves Left Behind
3256.733	The Hot Spring Seal
3369.833	The Glass Is Half Full!
3472.167	Luncheon Kingdom Timer Challenge 1
3521.367	The Broodals Are After Some Cookin'
3575.133	Under the Cheese Rocks
3602.667	Light the Lantern on the Small Island
3623.933	Crossing to the Magma
3633.600	Magma Narrow Path
3650.300	Surrounded by Tall Mountains
3682.300	Big Pot on the Volcano: Dive In!
3715.867	The Treasure Chest in the Veggies
3749.433	Overlooking a Bunch of Ingredients
3768.167	Alcove Behind the Pillars of Magma
3785.200	Climb Up the Cascading Magma
3822.800	Light the Far-Off Lanterns
3935.767	Cookatiel Showdown!
4012.933	In the Ancient Treasure Chest
4143.967	Battle with the Lord of Lightning!
4221.800	Behind the Big Wall
4253.500	Infiltrate Bowser's Castle
4332.000	Poking the Turret Wall
4340.567	Treasure Inside the Turret
4355.700	Smart Bombing
4387.000	From the Side above the Castle Gate
4425.400	Underground Jizo
4530.200	Big Broodal Battle
4564.333	Hidden Corridor Under the Floor
4597.167	Good to See You, Captain Toad!
4607.733	Inside a Block in the Castle
4645.467	Poking Your Nose by the Great Gate
4790.033	Showdown at Bowser's Castle
4821.100	Caught on the Iron Fence
4903.467	Caught Hopping on the Moon!
4914.767	Rolling Rock on the Moon
4934.333	Cliffside Treasure Chest
4984.033	The Tip of a White Spire
5005.600	Up in the Rafters
5351.033	Light from the Ceiling
5362.200	Loose-Tile Trackdown
5385.700	Pops out of the Tail
5407.900	Secret Path to Shiveria!
5441.067	Captain Toad is Chilly!
5453.333	Taking Notes: Snow Path Dash
5485.733	Snow Kingdom Timer Challenge 1
5497.233	Above the Freezing Fish Pond
5510.333	Ice Floe Swimming
5524.333	Deep in the Cold, Cold Water
5541.367	Snow Kingdom Timer Challenge 3
5552.367	Shining on High
5567.467	It Popped Out of the Ice
5592.600	Peach in the Snow Kingdom
5613.433	Icy Jump Challenge
5621.900	Atop a Blustery Arch
5645.000	The Gusty Barrier
5681.533	Behind the Snowy Mountain
5708.267	The Snowy Mountain Barrier
5700.267	Squirming Under the Ice
5735.633	Water Pooling in the Crevasse
5751.967	Treasure in the Ice Wall
5762.300	The Ice Wall Barrier
5811.300	Forgotten in the Holding Room
5854.800	Secret Path to Fossil Falls!
5891.900	Cascade Kingdom Timer Challenge 2
5900.967	Across the Floating Isles
5925.567	Good Morning, Captain Toad!
5937.833	Chomp Through the Rocks
5962.367	Atop a Wall Among the Clouds
5979.900	Cascade Kingdom Master Cup
5993.733	Treasure Under the Cliff
6007.467	Just a Hat, Skip, and a Jump
6040.200	Behind the Waterfall
6050.000	Taking Notes: Hurry Upward
6066.333	Inside the Busted Fossil
6077.100	Peach in the Cascade Kingdom
6091.200	Guarded by a Colossal Fossil
6099.600	Next to the Stone Arch
6121.300	Under the Ground
6133.067	Rolling Rock by the Falls
6153.533	Under the Old Electrical Pole
6162.367	Found with Lake Kingdom Art
6171.567	A Tourist in the Cascade Kingdom
6182.033	On Top of the Rubble
6199.933	Shopping in Fossil Falls
6209.467	Caught Hopping at the Waterfall!
6223.433	Cascade Kingdom Timer Challenge 1
6231.833	Bottom of the Waterfall Basin
6253.667	Secret Path to Bowser's Castle
6294.133	From Crates in the Moat
6310.400	Sunken Treasure in the Moat
6334.033	Above the Poison Swamp
6351.133	Knocking Down the Nice Frame
6366.933	On the Giant Bowser Statue's Nose
6379.533	Caught Hopping at Bowser's Castle!
6392.767	Caught on the Giant Horn
6407.600	A Rumble Under the Arena Floor
6424.067	Bowser's Kingdom Timer Challenge 1
6452.600	Jizo and the Hidden Room
6458.333	Jizo's Big Adventure
6477.700	Peach in Bowser's Kingdom
6497.133	Shopping at Bowser's Castle
6514.267	Third Courtyard Outskirts
6555.133	Taking notes: Between spinies
6573.600	Poking Your Nose in the Plaster Wall
6589.233	Taking Notes: On the Wall
6616.067	Small Bird in Bowser's Castle
6633.100	Past the Moving Wall
6662.433	Invader in Bowser's Castle
6683.567	Secret Path to Bubblaine
6707.200	Sea Gardening: Inlet Seed
6712.333	Above the Parasol: Catch!
6734.000	Treasure Trap Hidden in the Inlet
6755.667	A Light Next to the Lighthouse
6764.967	At the Base of the Lighthouse
6774.667	Bird Traveling Over the Ocean
6797.000	Shopping in Bubblaine
6812.633	Underwater Highway Tunnel
6825.200	Underwater Highway West: Explore!
6841.967	Found with Luncheon Kingdom Art
6859.833	The Tall Rock Shell in the Deep Ocean
6868.933	Under a Dangerous Ceiling
6875.600	Merci, Dorrie!
6888.567	Bubblaine Northern Reaches
6905.533	Gap in the Ocean Trench
6915.000	The Sphynx's Underwater Vault
6944.500	Caught Hopping at Glass Palace!
6955.967	Lighthouse Leaper
6973.900	Ocean-Bottom Maze: Hidden Room
7015.533	Taking Notes: Ocean-Bottom Maze
7026.100	Ocean-Bottom Maze: Treasure
7047.567	Glass Palace Treasure Chest
7061.800	Shh! It's a Shortcut!
7079.233	Slip Through the Nesting Spot
7093.600	Underwater Highway East: Explore!
7108.567	Rapid Ascent on Hot Spring Island
7118.833	A Fine Detail on the Glass
7135.267	Peach in the Seaside Kingdom
7146.567	What Shines Inside the Glass
7163.733	Secret Path to the Steam Gardens
7174.467	The Nut that Grew on the Tall Fence
7208.500	Path to the Secret Flower Field
7343.867	Defend the Secret Flower Field!
7369.767	Rolling Rock on the Moon
7375.067	Caught Hopping in the Forest!
7389.167	Shopping in Steam Gardens
7437.067	Looking Down on the Goombas
7463.467	Lost in the Tall Trees
7470.100	Behind the Rock Wall
7492.900	How You Doin', Captain Toad?
7522.367	Spinning-Platforms Treasure
7540.100	Over the Cliff's Edge
7570.300	Love in the Forest Ruins
7581.367	The Nut ‘Round The Corner
7594.833	The Nut in the Robot Storeroom
7604.700	High Up in the Cave
7628.500	Flood Pipeway Ceiling Secret
7645.433	Flooding Pipeway
7668.000	Peach in the Wooded Kingdom
7679.100	The Nut Under the Observation Deck
7690.900	Above the Iron Mountain Path
7703.467	High Up on a Rock Wall
7715.233	The Nut in the Red Maze
7745.500	Moon Shards in the Forest
7757.300	Wooded Kingdom Timer Challenge 1
7771.100	Bird Traveling the Forest
7792.400	Fire in the Cave
7828.500	Below Breakdown Road
7836.500	Down and Back Breakdown Road
7879.100	Wooded Kingdom Timer Challenge 3
7889.567	Thanks for the Charge!
7902.000	Wooded Kingdom Timer Challenge 2
7920.900	Secret Path to Tostarena!
7933.700	Top of a Dune
7954.433	Caught Hopping in the Desert!
7967.733	Hat-and-Seek: In the Sand
7988.633	Jammin' in the Sand Kingdom
8003.833	Hang Your Hat on the Fountain
8010.700	Desert Gardening: Plaza Seed
8022.067	Found in the Sand! Good Dog!
8034.833	Employees Only
8053.200	On Top of Stone Archway
8087.300	Love in the Heart of the Desert
8098.300	Bullet Bill Breakthrough
8110.400	Inside a Block Is a Hard Place
8118.700	On the Leaning Pillar
8132.600	On the Eastern Pillar
8147.900	The Treasure of Jaxi Ruins
8160.867	Island in the Poison Swamp
8169.733	Bird Traveling Wastes
8191.367	Sand Kingdom Timer Challenge 3
8203.933	Wandering Cactus
8218.000	Jaxi Reunion!
8228.733	Mighty Leap from the Palm Tree!
8236.267	Where the Birds Gather
8274.200	Taking Notes: Jump on the Palm
8295.400	In the Skies Above the Canyon
8311.533	An invisible Gleam
8318.833	Found with Bowser's Kingdom Art
8337.600	Sand Kingdom Timer Challenge 2
8373.867	Taking Notes: In the Wall Painting
8399.433	Secret of the Mural
8418.133	Peach in the Sand Kingdom
8432.333	The Lurker Under the Stone
8452.967	Welcome Back, Jaxi!
8472.833	Found with Wooded Kingdom Art
8489.100	Among the Five Cactuses
8512.033	The Bullet Bill Maze: Side Path
8524.267	The Bullet Bill Maze: Break Through!
8543.867	Sand Kingdom Timer Challenge 1
8560.133	On the North Pillar
8585.767	Skull Sign in the Transparent Maze
8595.833	The Invisible Maze
8623.533	Into the Flowing Sands
8631.600	Alcove in the Ruins
8658.100	On the Lone Pillar
8677.267	Secret Path to New Donk City!
8729.100	Sphynx in the City
8735.867	City Gardening: Plaza Planter
8744.133	Hat-and-Seek: In the City
8754.733	Found with Seaside Kingdom Art
8787.767	Metro Kingdom Regular Cup
8806.767	Metro Kingdom Timer Challenge 1
8817.133	Inside an Iron Girder
8837.700	Metro Kingdom Slots
8861.200	City Gardening: Building Planter
8870.900	Who Piled Garbage on This?
8893.033	Crossing Lines
8906.833	Peach in the Metro Kingdom
8924.267	Out of a Crate in the City
8941.267	Hat-and-Seek: In the Crowd
8949.800	Pushing Through the Crowd
8959.800	High Over the Crowd
8977.800	Hanging Between Buildings
8990.467	Bird Traveling in the City
9008.700	One Man's Trash…
9022.700	Bullet Billding
9042.600	Hidden in the Scrap
9059.967	Bird Traveling in the Park
9068.233	Found in the Park! Good Dog!
9094.100	Dizzying Heights
9111.567	Metro Kingdom Timer Challenge 2
9120.533	How Do They Take Out the Trash?
9140.500	Free Parking: Rooftop Hop
9169.167	Scaling Pitchblack Mountain
9180.133	Reaching Pitchblack Island
9208.400	Secret Path to Lake Lamode!
9234.000	Lake Fishing
9255.767	Taking Notes: Dive and Swim
9279.833	Behind the Floodgate
9288.867	Bird Traveling Over the Lake
9312.500	Love by the Lake
9348.467	Waves of Poison: Hop to It!
9353.467	Waves of Poison: Hoppin' Over
9377.500	Lake Kingdom Timer Challenge 2
9388.400	Peach in the Cascade Kingdom
9404.867	Found with Metro Kingdom Art
9417.233	Our Secret Little Room
9448.633	Deep, Deep Down
9459.367	Let's Go Swimming, Captain Toad!
9483.267	I Met a Lake Cheep Cheep!
9491.433	Skimming the Poison Tide
9510.367	Rooftop of the Water Plaza
9516.133	What's in the Box?
9562.967	Jump, Grab, and Climb Some More
9573.200	Jump, Grab, Cling, and Climb
9597.367	Secret Path to Mount Volbono!
9614.800	A Tourist in the Luncheon Kingdom!
9625.700	Caught Hopping at the Volcano!
9637.267	Atop a Column in a Row
9695.233	Fork Flickin' Detour
9702.133	Fork Flickin' to the Summit
9722.500	By the Cannon Pointed at the Big Pot
9731.667	On Top of a Tall, Tall Roof
9757.467	Luncheon Kingdom Timer Challenge 3
9771.700	Bon Appetit, Captain Toad!
9894.300	Hidden in a Sunken Hat
9915.733	Bonnetter Blockade
9934.067	Cap Kingdom Timer Challenge 2
9948.533	Shopping in Bonneton
9968.733	Precision Rolling
9990.700	Roll On and On
10018.433	Good Evening, Captain Toad!
10029.833	Fly to the Edge of the Fog
10043.067	Under the Big One's Brim
10059.733	Cap Kingdom Timer Challenge 1
10076.733	Peach in the Cap Kingdom
10087.100	Fog-Shrouded Platform
10104.533	Spin the Hat, Get a Prize
10112.567	Found with Mushroom Kingdom Art
10118.167	Next to Glasses Bridge
10132.767	Bird Traveling in the Fog
10152.000	Taking Notes: In the Fog
10165.800	Danger Sign
10178.467	Caught Hopping Near the Ship!
10241.533	Shopping on Forgotten Isle
10256.800	Peach in the Lost Kingdom
10282.167	Below the Cliff's Edge
10292.367	Wrecked Rock Block
10302.367	Inside the Rising Stone Pillar
10316.600	Get Some Rest, Captain Toad
10329.700	Jump Down to the Top of a Tree
10350.233	Found with Snow Kingdom Art
10364.167	Moon Shards in the Jungle
10378.400	Atop a Propeller Pillar
10391.900	Taking Notes: Stretch and Shrink
10404.467	Caught Hopping in the Jungle!
10423.200	Line It Up, Blow It Up
10430.200	A Propeller Pillar's Secret
10446.000	The Shining Fruit
10453.900	Lost Kingdom Timer Challenge
10505.867	A Tourist in the Moon Kingdom
10517.100	Found with Cap Kingdom Art
10526.833	Thanks, Captain Toad!
10535.833	Shining Above the Moon
10545.100	Sneaking Around in the Crater
10590.067	Piled on the Salt
10611.000	Flying Over the Lava Islands
10623.500	Treasure of the Lava Islands
10646.500	Light the Two Flames
10656.900	Lurking in the Pillar's Shadow
10679.667	Love Above the Lava
10693.467	From Inside a Bright Stone
10710.500	Luncheon Kingdom Timer Challenge 2
10725.800	Jammin' in the Luncheon Kingdom
10740.233	Corner of the Magma Swamp
10771.433	Luncheon Kingdom Slots
10787.867	Hat-and-Seek: Among the Food
10801.100	Is This an Ingredient Too?!
10815.167	Peach in the Luncheon Kingdom
10829.733	Golden Turnip Recipe 1
10844.900	Atop the Jutting Crag
10857.033	From a Crack in the Hard Ground
10869.400	Under the Meat Plateau
10894.333	Taking Notes: Swimming in Magma
10916.133	All the Cracks Are Fixed
10948.967	Secret Path to Peach's Castle!
10973.633	Jammin' in the Mushroom Kingdom
10987.633	A Tourist in the Mushroom Kingdom
11007.200	Shopping Near Peach's Castle
11021.133	Forever Onward, Captain Toad!
11036.900	Caught Hopping at Peach's Castle!
11043.733	Gardening for Toad: Garden Seed
11048.733	Gardening for Toad: Field Seed
11060.800	Grow a Flower Garden
11079.700	Mushroom Kingdom Timer Challenge
11098.733	Toad Defender
11120.100	Love at Peach's Castle
11132.600	Perched on the Castle Roof
11154.767	Rescue Princess Peach
11168.700	Achieve World Peace
11175.767	Power Moon Knight
11182.867	Power Moon Wizard
11189.967	Flat Moon Finder
11196.933	Treasure Chest Hunter
11203.967	Note-Collecting World Tour
11210.967	Timer Challenge Amateur
11218.033	Timer Challenge Professional
11225.100	Captain Toad Meeter
11232.267	Captain Toad Greeter
11239.267	Touring with Princess Peach
11246.300	Globe-Trotting with Princess Peach
11253.367	Gaga for Goombette
11260.433	Lakitu Fishing Trip
11267.467	Flower-Growing Guru
11274.433	Running with Rabbits
11281.433	Racing with Rabbits
11288.467	Ground Pound Instructor
11295.500	Ground Pound Professor
11302.567	Rad Hatter
11309.667	Super Rad Hatter
11316.667	Traveling-Bird Herder
11323.633	Hat-Seeking Missile
11330.700	Art Enthusiast
11337.733	Slots Machine
11344.800	Capturing Novice
11351.767	Capturing Apprentice
11365.800	Checkpoint Flagger
11372.833	Loaded with Coins
11738.800	Long Journey's End
